{"$schema":"https://json-schema.org/draft/2020-12/schema","$id":"knowledge/days-of-fortune-faq-1264-core-five-fact-snapshot.schema.json","type":"object","additionalProperties":false,"required":["snapshot_format","snapshot_id","source_id","source_url","retrieved_at","capture_policy","facts","non_claims"],"properties":{"snapshot_format":{"const":"fact_limited_official_support_snapshot_v1"},"snapshot_id":{"const":"tgc_faq_1264_days_of_fortune_core_five_2026_08_17"},"source_id":{"const":"source_tgc_faq_1264_days_of_fortune_core_five"},"source_url":{"const":"https://thatgamecompany.helpshift.com/hc/en/17-sky-children-of-the-light/faq/1264-patch-notes---january-11-2024---0-24-0-240551-ios-playstation-switch-241911-android-huawei/"},"retrieved_at":{"const":"2026-08-17"},"capture_policy":{"type":"string","minLength":1},"facts":{"type":"object","additionalProperties":false,"required":["historical_window_start_date","historical_window_end_date","new_items"],"properties":{"historical_window_start_date":{"const":"2024-01-29"},"historical_window_end_date":{"const":"2024-02-11"},"new_items":{"const":[{"item_id":"item_days_of_fortune_dragon_bangles","official_name_en":"Days of Fortune Dragon Bangles earrings","original_currency":"USD","original_cost":1.99},{"item_id":"item_days_of_fortune_dragon_vestment","official_name_en":"Days of Fortune Dragon Vestment outfit","original_currency":"USD","original_cost":9.99},{"item_id":"item_days_of_fortune_dragon_stole","official_name_en":"Days of Fortune Dragon Stole cape","original_currency":"USD","original_cost":14.99},{"item_id":"item_fortune_dragon_mask","official_name_en":"Fortune Dragon Mask","original_currency":"event_currency","original_cost":14},{"item_id":"item_fortune_drum","official_name_en":"Fortune Drum","original_currency":"event_currency","original_cost":34}]}}},"non_claims":{"type":"array","minItems":1,"items":{"type":"string","minLength":1}}}}
